name,ProductDescription,id
8701 Inc,Movement of non hazardous solid waste: the waste is going to be transported from job sites.,14148
Acro Service Corporation,"Acro is one of the nation's largest minority-owned total workforce solutions provider in the information technology (IT), engineering, professional, administrative and industrial labor categories. The company's services include: temporary staffing; managed service provider (MSP) programs for temporary labor; recruitment process outsourcing (RPO); cloud-based vendor management system (VMS) for managed temporary staffing programs; and, IT consulting and software development services. The company has over 40 offices in the U.S., Canada, Mexico, Europe and Asia, with 25 offices across the U.S.",4236
"ACTION TOOL & MACHINE, INC.",FULL SERVICE MACHINING AND ASSEMBLY FACILITY. ,3920
"Actron Integrated Security Systems, Inc.","Our company provides installation, service, and maintenance of Security Systems. This includes, Residential and Commercial Alarm Systems, CCTV Analytic Monitoring, Access Control systems, Virtual Presence and much more.",4344
Adam Divine Analytics LLC,"Adam Divine Analytics is a company that specializes in using Data analytics & Data Science to help companies solve critical problems within the organization. Although Data Science can be used to help solve many problems within any organization, we specialize in using Data Science/Analytics to help improve their Supply Chain Management. This is also known as Supply Chain Analytics. One of the benefits of using Data Science/Analytics in Supply Chain Management is, a good data analytics strategy helps solve critical problems such as: Uncertainty, variability, complexity of data and minimizing supply chain disruptions. 

Furthermore, Data Science/Analytics will be able to help companies in business modeling, scale of modeling, real time decision making, production and reporting. 
Some of the main skills we use to solve the problems mentioned are, python programming, statistical analysis, manipulating and cleaning data, visualization, forecasting and having knowledge of supply chain management in specific domains. 


As the owner of Adam Divine Analytics, I have certifications in Data Science from IBM, Duke University, and currently finishing up a Graduate Program from the University of Texas in Data Science & Business Analytics. The University of Texas was recently listed as the # 2 program in the world for business analytics. With my business coaching experience, continuous accumulation of knowledge in Data Science/Analytics, Adam Divine Analytics is excited about helping organizations strengthen their Supply Chain Management structure using data analytics, which is critical for sustained success in today's climate of uncertainty. 

Main Services: 
Written Supply Chain Management Strategy - Powered by Data Science & Data Analytics.
Implementation of Business Analytics Dashboard with Supply Chain Management focus. ",9995
Adapt Technology LLC,"Adapt Technology LLC offers complete engineering, CAD, FEA, engineering, metrology, 3D scanning, build, and staffing services with expertise in concept design through production manufacturing for the Automotive, Defence, Heavy Equipment & Consumer Products industries. The Company enables its customers to break through their design challenges by providing industry leading solutions that accelerate their product development cycle. The Company acts as a key part of the customers? think tank for concept design and packaging solutions to implement the requirements of design and manufacturing, by deploying an innovative and practical approach to clients? problems and requirements. These best practices have built up a strong customer base including, the US Army, GM, Hyundai, Toyota, ZEISS Group, and various more fortune 500 companies in a wide variety of industries.",4457
"Adroit 365, LLC","Big Frog Custom T-Shirts & More is a garment decorating Boutique specializing in DTG (Direct to Garment) printing, this is a process where we use a large inkjet printer and dye an image directly into the garment fibers, the image will not peel, crack or fade and will last as long as the garment. We appeal both to a newly created marketplace (1-100 garments) as well as offer other decorating services to service from 1 to 10,000+ custom garments. Other decorating services include screen printing, embroidery, ultra-prints, cut vinyl, and bling.  We are a 1-stop shop garment decorating boutique with no set-up fees, no artwork charges, no design fees and can have orders completed in as little as 24hrs!",14128
"Advanced CNC Technology, Inc ","CNC Machining of Prototype, Precision Parts and Fixtures",13298
ADVANCED ENVIRONMENTAL MANAGEMENT GROUP,"ENVIRONMENTAL MANAGEMENT, Compliance, training, permit application, vapor intrusion & radon mitigation, and CONSULTING SERVICES",4005
Advanced Magnet Source Corporation,Magnet supplier of various magnet parts and customer made magnets and magnetic assemblies,4063
"Advanced Matrix, Inc.","ADVANCED MATRIX provides compliance services in the areas of Environmental, Health & Safety - Regulatory and Statutory Compliance Management, Environmental Management System (ISO14001 Certification), Sustainability Programs and Environmental Due Diligence. Other areas of expertise include, but are not limited to, environmental permitting, environmental compliance audits, EHS training, ISO14001 certification assistance, soil and groundwater sampling and analysis, environmental site assessments, indoor air quality studies, noise studies, lead and asbestos management, health and safety program management, NEPA, Wetland studies.",13965
Advanced Protein Solutions LLC,"Advanced Protein Solutions (APS) offers ground beef patties that are 50% lower in fat than regular hamburger, yet are moist and juicy, contain antioxidants and vitamins, maintains its moisture when reheated, with no warmed over flavor.  Advanced Protein Solutions also offers manufacturers all natural ingredients to be blended into ground proteins that reduces fat, adds moisture and nutrients, increases yields and lower net manufacturing costs.  APS has a long history of providing patties to school food service since 1988.  Our formulation is USDA approved with Child Nutrition (CN) certification.  ",14065
Advanced Protein Technology LLC,"Advanced Protein Technology is wholesale and contract manufacturer for Licensed NutraCollagen Brand for formulation, production and e-Commerce on Amazon and NutraCollagen.com website ",13572
"ADVANCED UNDERGROUND INSPECTION, LLC.","Complete sewer rehabilitation, contracting services, pipeline video inspection, cleaning, repairing. Catch basin and manhole cleaning. Chemical Grouting. Link Pipe and Patch Pipe. CIPP Lining. Restoration & Landscaping",4102
"ADVANCING DIVERSITY IN CLINICAL TRIALS, LLC","ADVCT is a leader of clinical data management and biostatistics, clinical study management, and clinical research services poised to bridge the diversity gap in Clinical Research Trials to the life sciences industry.  We are dedicated to revolutionizing and improving healthcare disparities in clinical research trials by recruiting, educating, and expanding enrollment of ethnic minority participation in clinical studies. 
",13563
"Advantage Mechanical-Refrigeration, Inc.","Complete construction, service and maintenance of heating, ventilation, air conditioning and plumbing systems.",13661
"ADVERTISING SPECIALTIES, LLC.","IMPRINTED MERCHANDISE, PREMIUMS, GIFTS, INCENTIVES, TRINKET ITEMS, SHOW GIVE-AWAYS, APPAREL",14212
"AdWater Media Group, LLC","AdWater Media Group is an adverting agency providing comprehensive advertising consulting services as well as creating advertising campaigns and placing such advertising in periodicals, newspapers, radio and television, or other media. AdWater provides a full range of services, including but not limited to, advice, creative services, account management, production of advertising material, media planning, and buying (i.e., placing advertising).",14014
"Aegis Group Search Consultants, LLC","Healthcare executive, management and staff level search services",3795
"AEL SPAN, LLC",Supplier of logistics and electronics manufacturing services,4192
Aerostar Manufacturing,Precision machining & assembly services,4194
"Agile Services, Inc","Agile Tech Labs is a Technology Solutions, Services, Consulting, and Staffing organization.  Agile Tech Labs is focused on leading-edge and emerging technologies such as Robotics Process Automation (RPA), CyberSecurity for Automotive, Machine Learning, and Artificial Intelligence, Data Analytics, IT Application Development, Mobility, Microsoft stack, Cloud Computing, Quality Assurance (QA), Automation, DevOps, Business Intelligence and Data Warehouse. With its flexible yet robust engagement models of delivering turn-key projects, building onsite, nearshore & hybrid teams, and talent creation, Agile tech labs offer much-needed value-add to its customers.  Agile Tech Labs offers a range of engagement models such as turn-key projects and IT and Non-IT professional staffing (contract, contract-to-hire & direct perm).",4585
"Agile Zone, LLC","Agile Zone is a Minority Certified Enterprise (MBE), Michigan based IT Staffing agency and custom software development company. We provide consulting and implementation of Digital Marketing, eCommerce, Salesforce, Mobile and IoT development.
Our technology partners include Adobe Enterprise Solution, Shopify eCommerce and Salesforce consulting.
Our team is geographically distributed throughout the USA with office locations in Ann Arbor, Michigan and Cleveland, Ohio.

Core Capabilities:

Staff Augmentation
Adding value to organizations since 2012 by providing IT technical staffing resources with varied skill sets ranging from Business Analyst to Architect and Quality Assurance expertise.
Intrusion and Malware Detection

Digital Marketing
We are an Adobe Marketing Cloud and eCommerce Shopify Partner, helping businesses to grow with Internet presence to reach their clients and end users. 

Mobile Development
We help businesses from startups to large corporations fulfill their potential by implementing scalable Android and IOS mobile applications with latest technologies.

Salesforce
With Salesforce Partnership, we provide Salesforce platform administration and implementation for medium to large businesses.  We help our clients with MuleSoft as well.  
Intrusion and Malware Detection

Internet of Things (IoT)
We help businesses, startups, and entrepreneurs to make their IoT device and application dream into realty. Our start to finish full scale IoT offering includes hardware, firmware and mobile development and support.
Intrusion and Malware Detection
",4343
AHD-LLC,"Distributor and repair of industrial spare parts and components such as hydraulic, electrical,electronic and pneumatic components.",14265
Aibond Corp,"Aibond's product is a cloud-based supply chain management software solution. It powers enterprises to automate and track their maintenance repair & operations (MRO) workflows (repair management, warehousing, inventory, eCommerce and more) while keeping their Operations running at peak performance. Track & Trace software product by Aibond provides supply chain traceability solution. The video analytics products provides safety and security solutions. The engineering services offered by Aibond includes custom sensor integration in automotive electronics, autonomous vehicle and robotics software consultancy, functional safety assessment for electric vehicles including battery management systems and advanced driver assist system (ADAS) testing. ",13639
"Air Doctors Heating and Cooling, LLC.","We are a full-service heating, ventilation, air conditioning, refrigeration, electrical, and energy management company. ",13395
"Ajamu Group, LLC (The)","Corporate and Sporting events management, social media strategies, social media content creation, national advertising sponsorship sales and fulfillment. ",4129
AKAdams PLC,"A|Squared Legal Group assists businesses in corporate transactions and litigation, including business and contract disputes, intellectual property, and employment matters.  Additionally, A|Squared Legal Group consults in human resources management.",4269
Alana Metal Products Corporation,Sheet Metal Fabrication for various industries.,13737
Albaari and Partners LLC,"Albaari & Partners LLC provides Architectural and Engineering Design Services to both public and private entities. As a part of those services, the Firm also provides Estimating, Project Management and On-site Construction Management Services . Mr. Albaari is an AIA and NCARB Registered Architect with 30+ years of experience. He also is LEED BD + C certified. He has designed numerous public facilities, such as educational facilities, libraries and medical facilities as well as private industrial, commercial/office facilities, sports and entertainment facilities, and residential facilities. Ms. Albaari has 20+ years of experience in the construction management field, with significant experience and expertise in Estimating, Strategic Planning, and Construction Project Management. She is a Certified Project Manager Professional with LEED AP Certification. Both are respected professionals in their respective areas of expertise. ",13568
Albah Manufacturing Technologies Corp,"Engineering Service
Process and Physical Distribution
All Other Minerals Ore Mining Distribution
Other Commercial and Services Industry Machinery MAnufacturing",4292
"Alexander Legacy Private Wealth Management, PLLC","We work with individuals and families to help them make informed and educated decisions about their finances. We are on a mission to help 100,000 families create multi-generational wealth through legacy, philanthropy and impact. Our services include: financial planning, asset management, legacy planning, risk management and investment education.  We are dually focused on launching careers for the next generation to become financial advisors.",13496
Alfield Reeves Photography,"Alfield Reeves Photography provides professional photography services such as 
- Portrait Photography
- Editorial Photography
- Commercial Photography
- Headshot Photography
- Event Photography
- Wedding Photography",12508
"Algomus, Inc.","Algomus is ana analytics software company. Algomus grows the collaborative intelligence profile of an enterprise, with people and AI agents working hand in hand to deliver exponential business outcomes. Algomus has built Algo, an AI powered Business Analyst and an integrated workflow platform of its kind. Algo is always on. It mines Big Data and develops an internal representation and higher level understanding of an enterprise and its data environment to help business people get answers to their questions quickly, easily and accurately. Algo learns to perform tedious analytic tasks to give its human colleagues more time and freedom to be strategic and creative. Algo fosters collaboration through proactive opportunity finding, anomaly detection, insights sharing and story boarding.",4365
ALIM ARTS,Specializes in sales & distribution of Fine Art and African Art.,13696
Alka Rails & Manipulators LLC,"Material Handling Experts, Conveyors, Overhead rails systems, Carts, Racks systems, Shop Stocks, Flow Racks.",13685
All About Technology,"Computer Hardware, Software and Electronics Reseller
CompTIA Authorized Repair Center
Computer and Electronics Recycler
Microsoft Authorized Refurbisher.",4295
"All American Embroidery, Inc.","The company does embroidery, screen-printing and various promotional products along with sporting and recreational goods including complete uniforms for all sports.",13883
All in One Supply,Full line industrial supply and maintenance company,13966
"All N All Supplies, LLC","All-N-All Supplies, LLC is a supplier of educational resources, office products as well as medical personal protection equipment.  ",10923
"All Pro Web Design, Inc","All Pro Color is a Michigan based graphic design and commercial printing company that has fostered relationships and earned the trust of more than 30,000 customers nationwide. We pride ourselves in offering our services in the fastest turnaround time, at the highest quality and at the most reasonable cost.  All Pro has blossomed into a viable resource for entrepreneurs, small businesses, political campaigns, churches, non-profit organizations and everyday people. We print business cards, flyer, brochures, books, posters, lawn signs, wide format posters  and physical and digital marketing products.",13331
ALL STREET INDUSTRIES LLC,ALL STREET INDUSTRIES PROVIDES DUMPSTER RENTAL SERVICES FOR CONSTRUCTION DEBRIS.,13364
"All Tech Solutions, LLC","All Tech Solutions (ATS) provides design and implementation of audio visual and teleconferencing equipment to commercial and Federal Government.  In addition, ATS can configure and sell industry leading servers, storage arrays and networking applications.  ",14040
"Allegiance Technologies, Inc.",Information technology consulting & recruiting,4015
Alliance Prints LLC,Alliance Prints is a family-owned business. We are a full-service custom apparel and promotional products company with more than 50 years of combined experience. We have an extensive background in serving a variety of industries from healthcare and insurance to schools and sports teams.,13474
"Alliance Technology Solutions, LLC",Technology Solutions; Resale of hardware & software,13856
"Allied Home Health Care & Nursing Services, LLC","Providing in home health care services including nursing, physical therapy, occupational therapy, social work, health aide for a variety of health conditions: CHF, COPD, diabetes, wounds, infusion services, etc.",13903
Allograph Notary,"Allograph Notary is a mobile notary service. Allograph Notary specializes in general notary services, Power of Attorney documents, Trust certifications, Loan closings for real estate transactions, and estate planning.",13510
AllPackS,"AllPackS is a manufacturer and broker of pallets, corrugated boxes, packaging supplies.  Our specialty is in setup packs (also known as Pallet boxes, export packs, and many other names), but we are capable of servicing just about any packing supply need a customer may have.  We use our manufacturing capability and strategic relationships to provide a one stop shop for our customers' packaging needs.  

We manufacture and sell pallets and export packs / set-up packs.  

AllPackS is also a premier provider of warehousing, kitting, sorting, sequencing, and fulfillment services.  ",13320
ALLPERPLUS LLC,We offer a pesticide that's safe for humans plants and pets ,8977
"All-Pro Physical Therapy, LLC",Outpatient physical therapy services,4093
"All-Star Carpet Care, Inc.","carpet cleaning, specializes in carpet care using a truck mount cleaning sytem, tsunami extrator, hand held cleaners & top of the line products",14182
"Alpha Electric & Engineering, LLC","Electrical Design Systems, Electric, Electrical Design Software, Commercial/Industrial Electrician, and Design Electric.",13732
Alpha Moving Company LLC,"484210; 484210; 484210; Furniture moving, used
484210; 484210; 484210; Motor freight carrier, used household goods
484210; 484210; 484210; Trucking used household, office, or institutional furniture and equipment
484210; 484210; 484210; Used household and office goods moving
484210; 484210; 484210; Van lines, moving and storage services",5341
"ALPHA PLUS ENTERPRISES, INC.",WHOLESALE DISTRIBUTOR OF JANITORIAL SUPPLIES,3877
Alpha staffing solutions LLc,"Temp service personal to fulfill both front-of-the-house and back-of-the-house needs of hotels, banquet, catering. food and beverage and Health care facility, Factories etc. 

",14256
"Alpha Synopsys, Inc.","Consulting services, IT technology services and business improvement process to its customers, range from mid to fortune 500 companies.",13702
"Alphasoft Solutions, Inc.",IT Consulting Services ,4318
ALT3 LLC,"ALT3 provides technology consulting services. Providing in-depth knowledge on transformational services to help improve products and services rendered by organizations. As part of the consultation offers procurement services for hardware and software. With extensive knowledge of the communication landscape, we also provide radio and telephony communication services. ",13619
Alta Distribution LLC,"IWe are a distribution company that specializes in medical supplies and hotel supplies. Our products are manufactured in China by suppliers who can produce over 100,000 units per week. These products can be ordered and shipped directly to retailers within a few days. We will start with latex and nitrile gloves, and pillows, then expand into hotel and manufacturing plant products and equipment.",4381
AltaFlux Corporation,"Transformation of companies business processes using SAP Success Factors, Dell Boomi",4220
"ALTERNATIVE ENGINEERING, INC.","Designer & Builder of new and refurbished handling equipment & automation; chain, roller & belt conveyors, container handling, turntables, shuttles, transfers,lifts, indexes, over/unders, part handling, robot feeders, spiral chutes, sheet stackers and destackers.",3939
"Alternative Transportation Services, Inc.",Providing non-emergency medical transportation to clients with non-life threating situations,13884
Altimetrik Corp.,"DIGITAL TRANSFORMATION - INFORMATION TECHNOLOGY SOLUTIONS, SPECIALIZING CREATIVE TECHNICAL AND MANAGED SERVICES.",4031
"Alyko Enterprises, LLC","Corporate apparel, embroidery, screen printing, advertising specialties, promotional products, uniforms, Signs, banners, digital signage, trade show displays, ",4216
"AM PRESS, LLC.","CNC MACHINING, PRINTING,OFFSET, SHEETFED, WEB, FORMS. MAILING, VARIABLE IMAGING, FULLFILLMENT, PACKAGING, PROMOTIONAL ITEMS, DESIGN SERVICES, WAREHOUSING, DISTRIBUTION & DELIVERY",3786
"Amaeyaa Technologies, Inc.","Aamaeyaa Technologies, Inc. is a provider of information technology and engineering solutions to medium and large companies in North America. Our business focus includes custom applications development, systems integration, design and remote infrastructure management for Automotive, Energy, Health Care, Financials, Manufacturing, Telecommunications and Services sectors. Based in Farmington Hills, Michigan, we serve medium to large companies in North America. We believe that experience and knowledge is critical for successful business. We are in the process of employing some of the experienced and innovative minds in the business helping us build successful and critical business solutions/products. Aamaeyaa Technologies, Inc. provides best solutions and eventually enable our clients to manage their IT applications to achieve best results in their core businesses. Our philosophy is ?There is a solution for every problem. We exceed our clients? expectations and we make this happen because we strive to deliver the best solutions for most critical business problems.",4314
"Amarra Products, LLC","Amarra Products is a retail company that sells healthy, all natural beauty/skin care products and health and wellness products. ",13344
"Ambe Engineering, LLC","Full Service Supplier of contracts; Permanent, Employee, containment inspection,Problem Solving,engineering/ Manufacturing, Training and Off Shore Sourcing Support.",9096
"American Center Travel, Inc.",Full Service Travel Agency,3922
"AMERICAN HERITAGE GROUP, INC.","VALUED ADDED RESELLER OF PRINT TECHNOLOGY; EXECUTIVE SEARCH CONSULTANTS, PERSONNEL SERVICE, SUPPLEMENTAL EMPLOYMENT STAFFING.",4249
"American IT Solutions, INC","Information technology consulting, software development, support, solutions & services, enterprise applications, web design & development.",4227
"American Safety & Equipment, Inc.","Safety & Energy Solutions Provider - Machine Safety, Arc Flash/Electrical Safety, Lockout Tagout, Power Quality",13262
Americon Group Inc.,Construction Services,14186
AMERIMIN SYSTEMS,"DISTRIBUTOR OF TOOLING PRODUCTS, INDUSTRIAL CONTROLS, ELECTRONIC,  ELECTRICAL SUPPLIES, PACKAGING  MATERIALS, PLUMBING AND MECHANICAL MATERIALS,
 TECHNOLOGY INTEGRATOR OF NETWORK CABLING AND AUDIO VIDEO EQUIPMENT",4050
"AMMEX PLASTICS, LLC.","MANUFACTURER OF INJECTION MOLDED PLASTIC, KITTING, ASSEMBLY. RESINS & PLASTIC WHOLESALING",13834
"AMTECH ELECTROCIRCUITS, INC.","FULL SERVICE CONTRACT MANUFACTURE, DESIGN, ENGINEERING, MANUFACTURING AND ASSEMBLY OF PRINTED CIRCUIT BOARDS, WIRE HARNESS AND ELECTRONIC ASSEMBLIES",3955
"Amtech USA, LLC","International Business Management Company
We assist non-Japanese companies to establish and grow their business with Japanese automotive-related companies, such as Toyota, Honda, Nissan, DENSO, and Aisin Seiki.",4089
AMZ Infotech LLC,We provide IT Consulting and IT Contingent Staff Augmentation / IT Staffing Services to our clients all across the country.,13560
Analyzed Transportation Inc,"Our trucking company provides reliable and efficient transportation solutions for businesses and individuals. We specialize in the safe and timely delivery of goods, offering a wide range of freight services including long-haul, regional, and local transportation. With a soon to be growing modern fleet of well-maintained trucks and a dedicated team of experienced drivers, we ensure your cargo reaches its destination securely and on schedule. Whether you need full truckload, less-than-truckload, or specialized freight services, we're here to meet your transportation needs.",13585
