name,ProductDescription,id
"LM Manufacturing, LLC","Manufacturing of seats, and other interior trim components for vehicles.   Also, Logistics and Supply Chain Management.",13429
"Loco Promos, Inc.","Brand name wearables, PROMOTIONAL ITEMS, CUSTOM EMBROIDERED WEARABLES, SCREEN PRINTING, MARKETING TOOLS, Sporting Equipment",4072
"Logic Packaging, LLC","shipping supplies including: corrugated boxes, folding cartons, tape, banding, strapping, bubble, foam, flexible plastic, wrap, bags, labels, office paper, cleaning supplies, safety supplies, design, engineering.",13999
"Logic Solutions, Inc.","SOFTWARE PROGRAMMING, COMPUTER NETWORKING, WEBSITE DEVELOPMENT, INTRANET/EXTRANET, DATABASE DEVELOPMENT, INTERACTIVE MULTI MEDIA, SOURCING, CHINA LIAISON, OFFSHORE DEVELOPMENT, TECHNICAL STAFFING, MOBILE APPLICATION PORTAL, E-COMMERCE, DIGITAL MARKETING",3952
"Logical Owl, LLC","Logical Owl is a company that provides technology services. Our services include: consulting, phone, internet, cybersecurity, IT, low voltage cabling, fiber, cloud services, managed print services, merchant services, surveillance services, AV, and employee related administrative services. ",4447
"LogiConnect, LLC",Transportation company that provides business delivery services.,14033
"Long Insurance Services, LLC.","PROPERTY, CASUALTY, LIFE, HEALTH INSURANCE",3982
"Looking Glass Mechanical & General Contracting, LLC","Looking Glass Mechanical & General Contracting LLC provides heating and cooling service, installation, and repair for residential and light commercial buildings and applications in the greater Lansing area stretching through out lower Michigan. The goal of the company is to generate revenue and provide trade skills for myself and to other minority's in the greater Lansing area. We install an service furnaces, air conditioning, water heaters, air cleaners, humidifiers, zoning systems, water softeners, walk in coolers/freezers, ice machines, gas piping, and venting among other services. We offer 24/7 heating and a/c service as well. Our company can handle projects from as little as $250 to $100,000 at this point with much anticipated growth in the near future.",14276
Lorraine's Premium BBQ LLC,"Lorraine's Premium bbq sauce LLC is a manufacturer of condiments namely barbecue sauce. Our products are manufactured by a co-packer using Lorriane's Premium bbq sauce LLC recipes.  Currently there are four flavors of the premium bbq sauce line. Forthcoming are more flavors of the line as well as hot sauce, marinades, and dry rubs.",14153
Lotus International Company,"Lotus International Company (LOTUS) is a Michigan corporation with its global headquarters in Canton, Michigan. We specialize in the manufacturing, integration and testing of electronic and electro-mechanical parts, modules and assemblies.

Our global headquarters in Michigan provides 300,000 square feet of integrated state-of-the-art manufacturing areas, corporate offices, and over 20,000 square feet of high-tech clean room facilities.

Our vision is to be a leading supplier and service provider of electronic and electro-mechanical assemblies and modules for the automotive and consumer electronics industry. We apply a disciplined, process-driven approach while maintaining efficient operations by aligning with dynamic market conditions and the needs of our diverse customer base.
",3951
"LOU'S ELECTRIC, INC.","INDUSTRIAL-RESIDENTIAL, COMMERCIAL CONTRACTOR",14270
Love Empower Inspire Publishing L.L.C.,"Love Empower Inspire Publishing L.L.C. publishes inspirational children and adult fiction and nonfiction books that encourage people to be their best self. The products that we have created thus far are two inspirational children's books titled ""Love Empower Inspire I Am Wonderful"" and ""Love Empower Inspire The Best Me"". We develop every aspect of the books including editing, illustrations, book covers, formatting, purchase ISBN numbers, marketing, and promote to retailers, bookstores, and libraries. The primary goal of Love Empower Inspire Publishing L.L.C. is to help our communities across the world through inspirational, empowering books that will help motivate children and adults to be the best version of themselves. It is about helping empower our communities now and for generations to come.  ",14039
"LPS, LLC","Laser Printers
Re-manufactured and OEM laser toner cartridges.",4458
LPS-2,"We are a SDVOSB 100% owned company. We offer a complete line of re-manufactured HP cartridges alone with Cannon, Lexmark, Brother, Xerox Phaser equipment, and printer equipment repairs.",13869
"LSPEDIA, INC","Develop, market, and distribute software",13345
"LUB-TECH, INC.","INDUSTRIAL LUBRICANTS, LIGHT ASSEMBLY",13777
"Lumen Impact Group, Inc.","Lumen Impact Group works with a variety of organizations to perform visioning and strategy work that bring implementers, decision-makers and stakeholders together to hone and ensure realization of impactful visions, missions and goals through shared ownership, enthusiasm and accountability. Lumen provides Team Culture and Leadership Coaching that supports individuals and teams in using values, personal insights and tools to navigate their most challenging situations and capitalize on their greatest strengths and opportunities. Lumen also uses facilitation to provide alignment which helps leaders and teams deepen their understanding, commitment and accountability to the mission and each other. Lumen also supports clients in grant management and strategy.
",13477
Lumin Financial LLC,"Lumin Financial, LLC is an independent Registered Investment Adviser, providing investment advisory services to employer-sponsored ERISA retirement plans, and 401(k) plan participants as well as servicing plan trustees and fiduciaries in the various disciplines of investment management, fiduciary compliance, plan design, and participant education services.

Additionally, Lumin provides Family Wealth planning services to business leaders, as well as, people near or in retirement.  Family Wealth planning includes investment management, retirement planning, estate planning, tax planning, charitable giving and business succession.",14057
Luminaire Electrical Corporation,"Luminaire Electrical Corporation provides electrical work in the following core competencies: Service and general repairs, design and build and new construction, green upgrades and remodel on a commercial, industrial, and residential level. ",13401
"Lumpkins Private Wealth Management, LLC","A minority-owned asset manager providing a bundled solution of investment, advisory, fixed income and manager selection for retail and institutional clients.",4802
"Lush Yummies Pie Company, LLC","At Lush Yummies Pie Company we fresh back Lemon Butta pies with local ingredients and a fourth generation recipe. We wholesale our pies to large chain grocery stores and we ship direct to consumer through ecommerce. Lush Yummies Pie Co. Handmade pies are original in every sense of the word! Our rich creamy pies are filled with fresh squeezed lemon juice, local farm fresh melted sweet butter, warm cinnamon and sugar and hand poured to perfection. In each store that we are in, we stand out because we are the only ?Lemon Butta? pies in the entire store which automatically places us a step ahead of the rest. Not to mention, our pies receive rave reviews as most folks say ?these pies taste just like my mom used to make?. We believe that pie making is not just cooking, but it is an art and we strive to convey this message through our products and packaging.",4590
Luxury Homes Properties,The company primarily engaged in acting as agents and/or brokers in one or more of the following: (1) selling real estate for others; (2) buying real estate for others; and (3) renting real estate for others.,14155
LWS Consulting LLC,"LWS Consulting provides the following services 1) A variety of specialized training in leadership, mentoring, interpersonal skills, communications, Supplier Diversity and Call Center skills. Also, can assist companies by teaching existing training material, evaluate and/or enhance existing training material or develop customized training. 2) Initiation of of business to business relationships by assisting small diverse businesses to connect with majority owned companies and assist majority owned companies to find diverse suppliers. Also, assist small businesses with development of business plans. 3) Development and implementation of a Supplier Diversity program and evaluation and/or enhancement of a current Supplier Diversity program.",8021
"M Joyce & Associates, Inc","My company is a medical device distributorship with a focus on implants for total Hip & Knee replacement.  Also, we sell products to hospitals throughout multiple specialties to help save the Health systems money
",13509
M Parker Enterprises LLC,"M Parker Enterprises LLC is dedicated to assisting with the COVID-19 pandemic by supplying businesses and government agencies with personal protection equipment and other related products.  Additionally, we have added oral care/ dental care supplies such as dental floss to our product mix and currently supply one big box store.  Moreover, we are capable of sourcing and providing timely deliveries of FDA approved disposable 3 ply masks, levels 1-3 surgical, KN95, and NIOSH approved N95 masks.  Lastly, we are also able to supply a diversity of other office-business and other non-medical supplies upon request.",13325
M.E. Coats Development Group LLC,"We are a general contractor that specializes in rehabilitation, and sub work for contracts.  ",13317
"M.E. Designs, LLC",Architectural; mechanical; electrical; structural and interior design services,13942
"M3 Transportation, LLC","M3 Transportation is a premier transportation and logistics company committed to delivering reliable transportation solutions, exceptional value and ensuring excellent customer service.  As transportation specialists, we serve as an integral link in the supply chain management system. We recognize the critical nature of our role, and we are inspired to serve our clients reliably and competently, at all times. We are committed to quality performance and take pride in maintaining a great reputation with every vendor, customer and employee. Its our goal to empower our community with maintaining the highest level of freight transportation services. Operating out of Southeast Michigan, we have the capability and expertise to take care all of your transportation needs. No matter if it's local, regional, or national deliveries we can get the job done and we have the flexibility to customize our services to our customer needs. We provide our customers with on site management and a peace of mind for on-time deliveries. 
",14089
"Maahi, Inc","We supply office products, restroom supplies, office furniture, and IT hardware.

",4369
MABS Services LLC,"We offer support for all your construction needs including project management, auditing, staking, red lines, installation, site surveys, site preparation, and cleanup. Technology support includes mapping, wiring, network, support, installation, rack, and stack. troubleshooting and repairs.",4841
Mac Galleries llc,"Mac Galleries provides original, reproductive and digital art work. We also provide design consulting, custom framing and installation services.",13520
MacArthur Corporation,"MacArthur Corporation is a Michigan headquartered global supplier of labels, tags and die-cut components to the automotive, electronics and industrial markets serving customers in more than 20 countries from operations in the U.S., Mexico, Poland and China. With 50 years of experience, MacArthur Corporation creates solutions for the most demanding customer applications. The company is a certified Minority Business Enterprise (MBE), a certified Womens Business Enterprise (WBE), and a certified Women Owned Small Business (WOSB). IATF 16949. Certified ISO 14001. ",3818
"Machine-Star, LLC","Provider of plastic fabricated components and displays for industrial and retail markets. Full service capabilities include, design, fabrication, CNC machining, assembly and packaging.",13273
"Macias Floors, Inc","Flooring contactor & install all types of tile and carpet including removal of old flooring, commercial, industrial, office floors inducted.",14204
"Mad Dash Heating & Air Conditioning, LLC",We install warm air and air conditioning equipment.We install Duct material and all devices needed for equipment operation. (Residential and Commercial),4389
MADcrab Seasonings and Sauces,"Our product is a 16 blended spice, we have two types, a spicy and an original. Our blend is focused on seafood and vegetable flavoring.",14152
"Madison Street Holdings, LLC","Manufacturing of industrial dust, chip and mist collection systems for a variety of applications, including but not limited to:  metalworking, machining, casting, plastics, paper/document destruction, bakery & food processing, mining/mineral processing, rubber, and powder coating.  Supplier of replacement and aftermarket filters and parts.",4419
"Maestro Print Management, LLC",A full service print management company with sophisticated Internet driven software to simplify the procurement of printing and paper for corporations both nationally and globally.,13699
Magnificent Maids Inc,"Sales and services of Disposal, Chemicals, Plastic and Cleaning Products for residential and commercial properties.",14100
"MAKA SIL & Group Home, Inc","We offer affordable in-home care by providing and extensive range of non-medical services that can be utilized on a short term or long term basis. We provide services to individuals who are seniors, disabled, mentally ill, and/or cognitively impaired. We have Adult Foster Care Homes, Semi-Independent Living Services, and Community Living Support Services.",13907
Manufacturers/Machine Builders Services Company,"Machine Builder, Assembly Machines, Part Feeder Systems, Vision-Inspection Systems",3773
"Manufacturing & Automation Cost Solutions, LLC","The focus of my distributorship is high end Automation and Manufacturing SPARE PARTS and not the typical general MRO. This niche area covers Electrical & Mechanical spare parts related automated assembly systems, vision systems, robotic assembly, sensors, screw driving, leak testing, safety & lock out systems, adhesives, dispensing, conveyors, welding/soldering, injection molding and service mount technology systems to name a few. A supplement business that supports selling spare parts is the REPAIR of spare parts. To offer my customers additional cost solutions, I have also aligned myself with some of the MBE top repair centers in the US and Mexico.",4336
"Manufacturing Quality Resources Group, LLC","Full Scale OEM Level Automotive Yard Management Services, that include Vehicle Diagnostics, Repair and Retro-fit of all automotive components with a focus on Vehicle Electronics & Batteries.",4154
"Manufacturing Technologies, Inc"," Project management, Environmental Engineering. Filtration Equipment, Paint Shop Consulting, Manufacturing Engineering Consultants",13252
"MardonGroup, LLC","The MardonGroup LLC provides technology-driven marketing solutions, including:
Data-driven targeted variable print
Data-driven direct mail 
Fulfillment, kitting and distribution 
",4195
"Marimba Auto, LLC","CNC Machining Products, Tubular Products (steel, aluminum & stainless steel) Castings, Forgings & Rubber Hoses, Hardboard",4111
"Mario Morrow and Associates, LLC","Mario Morrow & Associates (MMA) is a communications, media and public relations firm.  MMA's primary focus is Marketing, Public Relations, Media Consulting and Crisis Management.  Our firm also provides the following services: media training, graphic design, polling, education and political analyzation. 
",13312
"Markare Services, Inc.","MAINTENANCE, LEASING OF HEAVY TRUCKS, TRAILERS",3934
Marlene L. Garland Agency Inc.,"EMPLOYEE BENEFITS INSURANCE AGENCY, THAT  DESIGNS, COMMUNICATES AND IMPLEMENTS MAJOR MEDICAL, DENTAL, VISION, LIFE, SHORT AND LONG TERM DISABILITY, LONG TERM CARE, CANCER, CRITICAL ILLNESS, HOSPITAL CONFINEMENT, IDENTITY THEFT PLANS,  AND EMPLOYEE PAID LEGAL PLANS SERVICES INCLUDE, BUT NOT LIMITED TO , BENEFIT ADMINISTRATION SOLUTIONS, IRS FLEXIBLE SPENDING TAX PLANS, AND COMMON BILLING",13247
"Martin Motorsports, LLC","ENGINEERING, AUTO RACING, TESTING SERVICES, ASSEMBLY, MANUFACTURING",3968
"Martin Painting and Maintenance Co, Inc.",Painting Contractors,13797
Marvel Earth Management LLC,"Marvel Earth Management LLC provides environmental services that include: waste characterization, hazardous and non-hazardous waste removal and disposal and PFAS remediation for soil and water.  Commercial structure demolition is a related, secondary service.",5082
"MasonBlue Technologies, LLC","MasonBlue is a global cyber security and risk management company.  We provide Cyber Security, Information Security related Risk Assessment, Compliance and Protection that comprises of both infrastructure services and development solutions to protect the assets of our customers. MasonBlue's Practice is built on a model to leverage scalable and reusable technology components coupled with effective analytics to offer a near perfect risk control along with streamlined business intelligence. Our core competence focuses on Security Program Development Support, Application Security Assessment, IT and Network Infrastructure Security, Web Application Security Testing, Information Security Services, Vulnerability Assessments etc. ",13334
"MATERIALS MANAGEMENT SERVICES, INC.","WHOLESALE DISTRIBUTOR OF GLOVES, SAFETY EQUIPMENT, JANITORIAL, INDUSTRIAL SUPPLIES, STEEL TUBING; OFFICE SUPPLIES",13796
Matthew LaVere Photography LLC,"Matthew LaVere is a Detroit based photographer specializing in portraiture, corporate, and advertising assignments. He works efficiently at solving problems  for clients. An avid traveler, Matthew uses his keen eye to capture images across the nation; he has photographed in major cities from coast to coast.  When he's not behind a camera, you can find Matthew mentoring photography students in Metro Detroit.",13578
"Maximized Security Systems, LLC","We sell, design, install, maintain, and monitor Life Safety and Electronic Security Systems including Fire & Intrusion Detection systems, Access Control & IP Video Management systems, and
other Low Voltage systems & services.",4562
Maximum Drive LLC,"Engineering Information Technology Services that work directly with computer systems, plant production equipment to provide data about the machine operations related to parts produced and non-production reasons with solutions that improve the function of the machine and flow production. 
",13566
"MBA Logistics, LLC","International & Domestic logistics consulting, brokering and management.",4170
"MBB Beauty, LLC","MBB Beauty, LLC is a Black-owned beauty retailer that curates products for your hair, skin and face made with us in mind. We sell hair accessories and will move into other lines in the future.",14126
"McCONNELL COMMUNICATIONS, INC.","Public Relations, Marketing, Crisis Management, Media Training, Social/Digital Media and email marketing.
We help individuals and companies tell their story in a manner that gets others to act.
",13739
"MCEM, LLC","PCBs and PCB assemblies, providing consulting services. 
Sales and marketing of Saw Blades",13723
McIver Industrial Safety Consultants,"Provide safety and environmental consulting services 
",4408
"McKelry & Associates, Inc.",TECHNICAL CONSULTING SERVICE FOR MANUFACTURING ,3949
"MCL JASCO, Inc.","MCLJASCO provides services to support the entire supply chain including logistic services, program management services, environmental conservation and restoration services, marketing consulting as well as staffing and placement support.  MCLJASCO is a vertically integrated organization that provides a full array of management services. Through our global partnerships, services are delivered anywhere in the world. A premiere, minority-owned, synergistic, value-added assembly, energy management, sustainable services and supply chain operating unites represent who we are.   Our deep industry knowledge enables clients to address issues specific to their businesses, and our unmatched global infrastructure provides the capacity and capability to help ensure we serve our customers extraordinarily well. ",4623
"MCM Staffing, LLC","MCM Staffing, LLC is a staffing provider of Temporary and Temporary to Hire staffing.  MCM has proven success in Commercial and Hospitality (Medical) Staffing. We have 10+ year service in the Hospital, Food, PPE, Auto and Aerospace manufacturing production space providing staff members in the area of skilled trades, warehouse, machine operators and forklift personnel.  Our commercial staffing side continues to staff document control clerks, administrative assistants, click to chat and customer service representatives. We are ACA compliant, responsible for all employer taxes, and we carry a $6M Umbrella policy.  We can provide our Worker's Comp & other Insurances Certificates upon request.

",4138
"MDJ Financial Services, Inc.","INVESTMENT
Products & Services
? Fixed Income Investments 
* Money Markets 
* Certificates of Deposits 
* Municipal and Government Bonds 
* Mutual Funds (income-oriented) 
* Unit Investment Trusts (income-oriented) 
? Equity Investments 
* Mutual Funds 
- Large Cap Growth/Value Funds 
- Small/Mid Cap Growth/Value Funds 
- International Equity Funds 
- Asset Allocation Funds 
- Sector Funds 
* Unit Investment Trusts (growth-oriented) 
* Publicly Traded Stocks 
? Retirement/Education 
Planning 
- 401(k) Plans - SIMPLE IRA 
- 403(b)(7) - Roth IRA 
(non-contributory) - Traditional IRA 
- Pension Plans - Coverdell Education 
- Profit-Sharing Plans Savings Account 
- Keoghs (formerly Education IRA) 
- SEP IRA - 529 Plans 
? Investment Accounts
(Traditional Brokerage) 
* Asset Account 
* Brokerage Account 
* Mutual Fund Investment Account 
? Managed Accounts (Fee Based) 
* Mutual Fund Wrap Program 
- Capital Visions: A Comprehensive 
Approach to Mutual Fund Asset Management 
* Professionally Managed Accounts 
- Classic Strategies: Personalized Investment 
Portfolio 
- Lockwood Financial?s Managed Account 
Link Program 
- Brinker Capital?s Core Asset Manager
? Fee Based Brokerage Account
 * CapAdvantage
RISK MANAGEMENT
Products & Services 
? Life Insurance 
* Annual Renewable Term 
* Level Term-- 5.10,15, 20 and 30 Year 
* Whole Life 
* Universal Life 
* Variable Universal Life 
* Survivorship Variable Universal Life 
* Survivorship Universal Life 
? Annuities 
* Fixed (single premium & immediate) 
* Variable Annuities (immediate & periodic 
payment) 
* Group Annuities (qualified retirement plans)
? Disability & Long-Term Care 
Planning
* Individual Disability Income 
* Group Long-Term & Short-Term Disability 
* Business Overhead Expense 
* Disability Buyout Protection 
* Individual & Group Long-Term Care 
? Health Insurance
* PPO 
* HMO 
* Indemnity Plans 
* Individual & Group Medical Plans 
? Business Planning 
* Executive Bonus Plans 
* Business Continuation Plans 
* Key Person Plans 
* Split Dollar Plans 
* Group Carve Out Plans 
* Salary Continuation 
* Deferred Compensation Plans 
* Executive Benefit Plan Administration 
* Executive Planning Services 
* Buy-Sell Funding",14150
"Medina Resources Group, LLC","Medina Resources Group will be a subcontractor doing the following: The building and/or repair of concrete slabs, walls, curbs, gutters, or any kind of work pertaining to concrete; concrete coatings on any vessel or pipe that is susceptible to corrosion or catching on fire; or surface preparation and application of ratings on anything needed to be protected from environment or environmental changes; consulting/inspection work for Gas and Energy, commercial work, and industrial work; supplying materials to any jobs needing coating or needing materials to aid in captain; supplying any other needed resources to fulfill a construction job.",4395
Med-Kas Manufacturing LLC,"Design, Engineering, and Manufacturing of machined parts specializing in Hydraulic Manifolds. ",4525
"MedSupply Corporation, Inc","Personal Protection Equipment (PPE), Surgical Mask, N 95 mask,KN95 mask, gloves, gowns, shoe coverings, Tyvek Suits, Hand sanitizer, Dispensers, Temperature Gates, Metal Detection.  Customized fabricated or off-the-shelf Prosthetic and Orthotic devices (prosthetic Legs & Arms, Knee Braces, Back Braces, Hand Splints, Ankle Foot Orthosis, Diabetic Shoes, Foot Orthotics, Neck Collars, etc. to patients of Hospitals, Nursing Homes, and Doctors offices via prescription.  Durable Medical equipment, Wheel Chairs, Hospital Beds, Rollators, Patient Lifts, Walkers, Crutches & Canes, Enteral (Tube Feeding), ",13404
"Melagro Technology, LLC","We are a health care integrator.  We provide behavioral health screens and health care integration to Hospitals, Primary Care Physicians, Health Maintenance Organizations, Home Care Organizations and other health care organizations",14076
