name,ProductDescription,id
"Reliance One, Inc.","Reliance One Inc. is a minority-owned, MMSDC-certified staffing corporation headquartered in Michigan with a focus on matching the ideal professional to a client's specific needs for both long-term, short-term, or project-based positions (including temporary, temporary to direct, or direct). 2.; Since 1998, Reliance One has employed thousands of employees and has served hundreds of clients in various industries, including Medical, Information Technology, Automotive, Finance/Accounting, and Manufacturing. These clients rely on the flexible solutions that Reliance One provides which translate to marked improvement in performance, a reduction of costs, and the use of timely resources. 3.; Reliance One, Inc. has been recognized by Crain's Detroit Business as one of the Top 20 Largest Staffing-Service Companies and the Top 30 Fastest Growing Companies within the State of Michigan.",4054
Reliance Rubber Industries Inc.,"Manufacturer of molded rubber parts and extruded rubber profiles.  Manufacturer for the automotive, aerospace, industrial, food and beverage, pharmaceutical, and medical industries",14015
Relocation Team LLC,"Relocation Team assists with relocating small businesses, non-profits, schools, and municipalities in the Metro Detroit area.  We help with the telecommunications including hardware, services such as wireline and wireless.  In addition, we help provide them with additional assistance such as getting in touch with other professionals that is helpful.   We are not the phone company, yet have contracts to provide those services which in some cases allow for savings.  We additionally provide telecommunications management to ensure that our clients are not overpaying for services or the bills spiraling out of control.  We help with all different types of needs and carriers such as Xfinity, ATT, Verizon, TMobile (Sprint) US Telecom, XO, WOW, Brighthouse, for example - and there are many more.  We work with our broker and we work hand in hand so there is a large back office, customer service department if there are any questions.  The bills would come from the carrier/provider.  
",14132
Remier Distributing Inc.,"Distributor of replacement general lighting such as bulbs;flourescent lamps; indoor & outdoor fixtures;and specialty lamps as in Dental, Medical Maraaine Stage & Aviation.",14183
"Renaissance Age Management Institute, PLLC","Reference laboratory, urine toxicology internal medicine, ",13986
"Renaissance Appraisal, Inc.","Renaissance Appraisal, and its team of local and highly experienced appraisers, has established itself as one of the leading appraisal companies in the Detroit Metropolitan area by providing fair, accurate, and honest appraisal services and focusing on what matters?. people. We are licensed and insured Certified Residential Appraisers and approved vendors for the Federal Housing Administration (FHA) and the U.S. Department of Veterans Affairs (VA). In addition, to national lender clients, our clients include local credit unions, attorneys, investors, private homeowners, and some of the best real estate agents in the country.",13336
"Renaissance Capital Alliance, LLC",EQUIPMENT FINANCING AND LEASING,4105
"Renaissance City Transportation, LLC",Trucking/Expediting Broker Service,3782
"Renaissance Consulting Group, L.L.C.","Health and Safety for All offers Live and Virtual Life and Health Coaching, eCourses training, Nutrition Supplements, LifeVac Devices, Customizable Class A & B First Aid Cabinets with Refill Services. Customizable Type I, II, III, and IV Kits.  Automated External Defibrillators and Supplies and STOP THE BLEED® Trauma Kits. Bandages and Bloodborne Pathogens Control Kits. UV Light Chemical Free Air Disinfection Systems.
 
 
",13380
"Renaissance Global Logistics, LLC.","GLOBAL CONSOLIDATION, SHIPPING SERVICES, REPACKAGING, LEAD LOGISTICS PROVIDERS.",4609
"Renaissance Real Estate, LLC",Office Space Rental,4107
RENEE WALKER & ASSOCIATES LLC,"Established in 2012, RENEE WALKER & ASSOCIATES (RW&A) is a strategy, brand, and marketing communications agency that works with select companies, organizations, executives, and advocacy campaigns to solve complex communication challenges and help our clients achieve higher performance, productivity, and profits.

Services: strategy, brand, marketing, communications, agency, branding, public relations, media relations, public affairs, marketing communications, digital, social media, community outreach, stakeholder engagement, professional development and training, strategic planning, fractional CMO, outsourced and on-demand marketing services.

",4153
"Republic Pharmaceuticals, LLC","Republic Pharmaceuticals distributes Rx pharmaceuticals (control and non-control)  to independent pharmacies, physicians and hospitals",4303
"Revive Surgical Instrument Service & Repair, Inc","Revive is a Service Company providing ONSITE refurbishing and repairs of Stainless-Steel Instruments and Endoscopes that are utilized by Surgeons and Physicians in Hospital Operationg Rooms, Surgery Centers, Medical and Dental facilities.",13858
"Revived Leaves, LLC",Revived Leaves LLC offers high-end disposable tableware made from USDA Certified Biobased product to enable an eco-friendly alternative to conventional tableware products for businesses and consumers across North America to achieve corporate and social responsibilities of reducing environmental impact.,14042
Revize Software,"We are a web content management software (CMS) and web design company. We sell our CMS software, apps and design services to our customers to manage/publish the content on their web site. Using our software, non technical personnel on client side, can update and publish the content in the website on their own without any dependance on any technical staff. ",4424
"Revolutionary Designz, LLC","Our company focuses on websites for small to medium size companies and printing for small, medium, and commercial businesses or organizations.",4321
"Reyz, LLC","The Company is a community-focused, forward thinking, apparel brand that uses the best quality materials and technological innovations to create the most luxurious, fashion-forward, and functional bras for breast health and post-surgery recovery.   We have two primary offerings:
1. Specially designed and knitted comfort bras, focused on sensitive needs including breast cancer patients (NAICS:315190/453998 & Balance Sheet: Inventory)
2. Curated gift boxes for wellness, specifically focused on women with sensitive needs including breast cancer patients (NAICS: 453220 & Balance Sheet: Inventory)
We also seek strategic partnerships to promote well-being through textile innovation and design.",13437
"RFG/MPW Environmental & Facility Services, LLC","Environmental Management: Our Sustainability Management Programs utilizes environmental compliance knowledge and professional experience to bring the customer a cost-effective outlet for the transportation and disposal of waste by-products and recycling materials.  We develop sustainable programs with emphasis on continuous improvement processes that maintain compliance, while effectively reducing landfill waste through the diversion of beneficial reuse materials for recycling.
Facility Management:  We offer customized programs that include full-time, round-the-clock cleaning and labor support, paint shop management, operations and maintenance, engineering services, and commodities management.  We provide an analytic approach to streamline our customers? operations allowing us to become an integral part of their production process.
",4358
"Richard Stuart, Inc","Richard Stuart, Inc is involved in the procument of temporary to permanent general contracting employees, including general labroers to specialty trades (ie Electrical, HVAC, Framing and Plumbing), for the purpose to build/errect commercial structures.",14248
"Ringo Services, Inc","Ringo Services provides Integrated Facilities Management (IFM) for Educational Institutions, Commercial Interests, and Government Entities.  IFM is a convenient, full service option for any organization.  It drastically reduces costs and ensures high quality in all aspects of facility upkeep and maintenance.  We manage and supervise all operations, maintenance, and servicing of a facility in a manner that is consistent with the highest standards of professionalism skill, workmanship, and applicable trade practices while conforming to all applicable codes and regulations.  IFM services include but are not limited to Custodial, Engineering Operations, Engineering Maintenance, Landscaping, Pest Control, Snow Removal, Other Trades, and Capital Improvements.",14054
Ripe Harvest Foods LLC,"We develop, pack and sell dry pasta, dry mixes, bread, muffin, cake, and cookie doughs and. All products are gluten-free. ",14277
"River City Metrology, LLC",Accredited calibrations and service coordinate measuring machines.  Dimensional Inspection and 3rd party certifications.  Reverse engineering.,13695
Riverside Power Systems LLC,"Riverside Power Systems LLC provides world class electrical installation, modification and testing (NAICS Code 238210 - Electrical Contractors and other wiring installation contractors).",14082
RIZZARR Inc.,"RIZZARR is a tech-enabled content marketplace that helps brands work with and create digital media alongside Millennial and Gen Z content creators for their marketing needs. RIZZARR acts as an intermediator, enabling brands to find and partner with its network of over 5,000 talented content creators from around the world. RIZZARR cultivates its content creators in producing purpose-driven articles, social posts, videos, podcasts, and photos. RIZZARR also helps brands by providing them with data, creating in-person or virtual events for audiences, as well as our marketing campaigns and services. ",4576
"RJ Printing, Inc.",OFFSET & DIGITAL PRINTING,4036
RKAA Business LLC.,"RKKA Business, LLC DBA Chippewa Plastics is in the business of molding plastic parts for Automotive, Defense and Consumer Products. It also has a tool room for mold manufacturing and maintenance. Has 20 molding machines from 22 tons to 1000 tons. Has 72,0",4156
"RM International Resource Group, LTD.",We provide consultative procurement services to our clients within the office area and have technology driven solutions to support the procurement process and the procurement of goods.,4009
"RMH Construction, LLC","RMH Construction LLC does everything from Commercial and building construction, drywall and insulation, painting, flooring and full residential remodels.",13854
"RnD Engineering, LLC.","Custom machine builder.
Expert in polishing also called tape finishing, Lapping, super finishing, micro finishing.
We design, build, install, service, upgrade, retool,  custom machines that is best suited to your factory.
From basic manual machines to sophisticated multi-station machines with integrated robots.
We develop processes for your most challenging specifications. 
We have met all the surface finish specifications that we have been challenged with.
",13689
Roasting Plant First National LLC,"Roasting Plant Detroit opened in the First National Building in downtown Detroit in February 2013 in the midst of the City's bankruptcy and represented the Company's first location outside of New York City. This new location included a brand refresh - complete with new logo, tagline, color palette and retail look/feel. It was also among the first brands to venture downtown, well before established brands such as Nike, Shake Shack and Warby Parker. In fact, the history of the Roasting Plant brand and the resurgence of Detroit go hand in hand - you cannot have a discussion about one without mentioning the other.
 
Our store was so well embraced by consumers, it was cash flow positive in its first month and continues to post impressive results even today. It goes without saying that the coffee is incredible, and the reviews from both customers and the media are extremely favorable (>220 4.5 Star reviews on Yelp and #1 rated in Detroit).
In November 2016, actor/author/activist Hill Harper and entrepreneur/investor Matty Yohannan purchased the Detroit location to much fanfare - not only as providing the freshest cup of coffee in the city but also as an engine of economic empowerment for Detroit and its young residents. They plan to open additional stores in and around Detroit and greater Michigan, as well as to build a large-scale Javabot? manufacturing, warehouse and distribution facilities - creating economic growth and much needed jobs. 

?Detroit is a great American city that was forged on innovation, social enterprise and entrepreneurship. My ownership of Roasting Plant Coffee in downtown Detroit builds upon that legacy. It is truly an honor and privilege for me to help fuel the Motor City, not just with Roasting Plant?s incomparable coffee?but by providing career paths and launching pads to greater success in a booming industry for young Detroiters hungry for opportunity and active mentorship,? said Harper. ""Having lived here filming two movies in Detroit over the past four years, I have come to love this city and its people. I believe in Detroit. It is truly a vibrant, unique and great American city.? -Hill Harper
Both Hill and Matty are direct investors in Roasting Plant, Inc. and serve as Advisors to the Company.

OUR COFFEE...
At Roasting Plant Detroit, we believe that every person deserves a perfect cup of coffee. No exceptions.
So we travel the planet in search of the highest grade specialty coffee beans and utilize our own state of the art roasting technology called Javabot to deliver a just-roasted, brewed-by-the-cup experience...

Just Roasted. Just Brewed. Just For You.",13372
"Robin Cash, PhD, LLC","Robin Cash, PhD, LLC (DRC),  a management consultant firm established in 2016.  With a focus in technology, DRC delivers transformative technical strategy and roadmaps, product & technical delivery management, quality improvement strategy and path forward to maximize investment along with technical & leadership education. DRC delivery methodology includes a fact-based approach for measuring results that demonstrates our quantifiable improvements. 
",4509
"Rockwell Earthworks, LLC","Rockwell Earthworks was formed in 2020 to serve commercial and residential clients with engineered landscaping services and is headquartered in Ada, MI. We are a minority, women-owned company with a management team that has diversified experience in Fortune 500 corporations. We are a small business whose mission is to design and deliver services that cultivate trust between our customers and ourselves.
Landscape Services
Commercial and Residential Landscape Services, Design and Installation, Erosion/Water Management, Irrigation Services, Hardscaping, Snow and Ice Management, Turf Services

Site Preparation Services
Commercial and Residential Excavation Services, Erosion/Water Management, Storm Drainage
",13376
"Rodco Express, Inc.","Rodco Express has a long history in the transportation industry, including logistical coordination, along with physical transportation. We are capable of providing transportation for dry, liquid and aggregate materials.",3942
"Rodnick Co, LLC",wholesale and retail supplier of custom fruit and gormet gift baskets.,13715
"Rodriguez Drywall Finishers, Inc.",Drywall hanging and finishing for new residential and commercial buildings,13738
"Rodriguez Expedited Freight Systems, Inc.","LOGISTIC MANAGEMENT, INTERSTATE, INTRASTATE EXPEDITED FREIGHT TRANSPORTATION/AIR FREIGHT",3938
Rogers Wm. Foster Freelance Photography,"PHOTOGRAPHY FOR EVENTS, EXECUTIVE PORTRAITS",3762
Rolling Star Logistics LLC,"Rollingstar Logistics LLC in an intermediary between shippers and freight service providers.  We specialize in hauling certain types of freight such as equipment hauling, oversize, bulk tanker, auto and other types of freight transportation.",13385
Rollings Solutions LLC,"Rolling  Solutions is a small minority owned trucking  firm headquartered in Michigan. Started by Antony Rolling, we specialize in local and interstate trucking needs and transport cargo including consumer goods, hazardous chemicals, automotive parts, and ",13434
Rooftop Candle Co.,Studies show that 60% of customers were more inclined to purchase when scent was involved. Discover the world of Rooftop Candle Co as we go beyond our traditional candles and help to increase your revenue with our ambient scenting-diffusion (including HVAC) solutions available for businesses and public venues. Let us inspire you and reveal the art of sensory marketing!,13545
Round Tree Transport LLC,"Transportation of perishable and non-perishable products.  Services include load planning, carrier setup, e-sign, invoicing and paperwork, shipper credit checks, rate negotiation, profitable freight, factoring, reefers, power only dry vans",14094
"Roundview Technologies, LLC","Roundview Technologies serves manufacturing clients in the area of Enterprise Resource Planning software implementation services, system integration services and custom development services.",4547
Rowe Trucking LLC,"484220 - Specialized freight (except Used Goods) Trucking local - Dump trucking (e.g., asphalt, gravel, sand, top-soil)
488490 - Snow clearing, highways and  bridges, road transportation
488490 - Snow removal highway",13339
RSB Technologies LLC,"We provide the following services:
- transcription srevices
- Scanning and indexing of documnets
- File conversions and Meta Data building
- Contract Programming",14002
"RSCM, LLC","Carrier mgt, Monitoring and Reporting.  Support new launch activity/program and start-up.
Track and Trace.",4351
"RSI of West Michigan, LLC","RSI of West Michigan provides precision CNC machining and turning to a variety of components including die castings, stampings, weldments, forgings, and extrusions. The company is experienced with a variety of  materials such as aluminum, magnesium, aluminum and silicone alloys, aluminum and magnesium alloys, steel, zinc and titanium. RSI offers quick turnaround in as little as 24 hours and has the ability to provide 3-D printed samples and fixtures used to expedite the manufacturing process. The company has an ISO9001-2015 certified quality management system. ",13660
RSLS Corporation,"Signarama Shelbytwp is a full service sign supplier.  We design, manufacture  and install signs of all types, including, banners, interior and exterior signs, monument signs, post and panel, decorative street signs, digital, LED displays, neon, magnetic, dimensional letters, flags, custom floor,  window and wall graphics, vehicle and boat  graphics, vehicle wraps & mobile advertising , directory, ADA, plaques and office signage, site and real estate signs, light boxes, channel letters, menu boards, trade show displays, point-of-purchase and changeable side walk signs,  decals, stickers  and labels, frame style signage and much more.
 
Your sign need is our #1 priority. We will deliver world class quality and service at a competitive price.
",4151
"RTI Laboratories, Inc.","INDEPENDENT LABORATORY TESTING SERVICES INCLUDING CHEMICAL, METALLURGICAL, ENVIRONMENTAL TESTING.",4046
"RTW & Associates, LLC","CONSULTING, COMPUTER INFRASTRUCTURE, NETWORKS",4032
"Rulon & White Governance Strategies et al, LLC","Provides pension plans to qualified employees, such as Mutual Funds, Qualified plan's Pension: Treasury Management, Asset Management",13899
"Rush Distribution Service, Inc.",General Business & Logistics Consulting Services,3915
"Rush Group Limited, LLC",Business Consulting,13270
"Rush Group, LLC",General business consulting & financial advice,4094
Rush Trucking Corporation Headquarters,"TRANSPORTATION OF GENERAL COMMODITIES, expedites, Truck Load and Milkruns.",3858
"Ryan Industries, Inc.","CONTRACT PACKAGING, LIGHT ASSEMBLY, KITTING, DISTRIBUTION, WAREHOUSING AND SUPPLY CHAIN MANAGEMENT",3947
"Ryan Properties, LLC",Property Management,13255
Ryter Cooperative Industries,"Ryter Cooperative Industries (RCI) is a project management company creating a brighter future beginning with, but not limited to Metropolitan Detroit, through the application of innovative technology, renewable energy solutions, and collective creative ideas by providing engineering and design support, project management, and educational services for community development and empowerment. ",14167
"S & D Mechanical Services, Inc","Mechanical contracting installation and project management for the process piping, plumbing, HVAC, piping insulation and refrigeration in industrial facilities.",4262
"S & N of Troy, Inc.","Full Service Trave Agency supporting business and individual clients. Products and services include, Domestic and International air, cruises, train, hotel, car rental bookings and reservations. Group bookings and vacation packages to most destinations. Ex",3958
"S & V Technologies, Inc.","Distributor of automotive powertrain, drive train components; technical consulting.",13888
"S R I Business Solutions, Inc.","Software development, Business Transformation Services, Engineering Services, Manufacturing consulting, project/ program management services, It staffing including staff augmentation.",3990
S&A Technology LLC,"Our business is mainly focus on supplying different products to OEMs, such as wire harnesses, sensors, jumpers, battery cables, rubber parts, fuse boxes, injection molding, stamping, die-casting, foundry, and electronic assembly. ",13465
S.T.P. Enterprises,"STP Trucking is a dedicated motor carrier that takes pride in offering transportation services to our customers in a manner that meets their needs.  We do local, regional and some long-distance routes.  Our Aim is to operate with the highest level of professionalism and expertise.",13495
"S5 Technologies, Inc","Plastic component engineering, assembly and storage, sorting and containment.",13880
"Saenz Consulting, LLC","Environmental management and regulatory testing services to the telecommunications industry.  Primary focus is on federal and state regulatory compliance requirements pertaining to above ground storage tanks (ASTs) and underground storage tanks (USTs) used to fuel emergency generators.  Key compliance services include Michigan Class A/B/C Operator record keeping, inspections, and training; in addition to site surveys, compliance repair management, and regulatory liaison to facilitate mandated government triennial facility inspections.  ",4528
"Safety Margin, LLC",Distributor of Residential and Commercial Safety Products and Devices,13971
"SAGA MKTG, LLC","Saga MKTG LLC is a full service marketing agency specializing in branding, digital strategy, and outreach ",13855
"SageOne, Inc","Staffing agumentation, strategic consulting and system integration services. Services can be delivered on-site or off-site.",13698
"Sakoma, LLC",Distributor of electrical and electronic products and raw materials of manufacturer of these products.,13908
Samani Company LLC,"Our company creates bags (with handles) of different sizes to wrap and secure furniture for ease of transport. Additionally, we create fabric-based containers for moving and storage and for a host of other uses. We create custom heavy-duty bags for various clients also.",13611
"Santanna Tool & Design, LLC","Assembly, Build, Design, Engineering, Fabrication, Machining, Project Management, Robotic De-racking, Robotic Racking, Sealing Applications, Sub assembly Build Up, Systems Integration and Decommissioning ",3701
"Santoki, LLC","Santoki is the exclusive US importer and distributor of LEGO lighting, stationery & lifestyle products. Our product is sold into a variety of different channels, including mass markets, specialty retail, amusement venues, and direct to consumer. Visit https://www.amazon.com/iq to learn more about our product portfolio.",10773
"Sapana International, Inc.","Pole Line Hardware, Polymer & Porcelain Insulators, Fiberglass Cross arms & Structures, Solar and Wind Energy Products, Forgings & Castings, Automatic Connectors, Foundation Anchor System, Anchoring System",13846
Saras America Incorporated,"IT Staffing, Consulting, Solutions and Training",3984
Saturn Electronics Corporation,Manufacturing of bare printed circuit boards,3871
SAZ LABS INC,"SAZ Labs Inc is a company formed by Software professionals with combined 50+ years of experience in the software industries; specializing in enterprise architecture, development of software products, near-shore and off-shore development, and providing software technical resource services to fortune 200+ clients.

SAZ has specialized in few niche area of interest, which are as below:
1. Enterprise Software Development
    a. Architecture Solutions - Cloud, Web, Middleware, Backend, Security, Legacy
    b.Software Solutions - J2EE, Spring, Tibco
    c. Big Data and Cloud Solutions - Hadoop, Cassandra, Amazon Web Service - (EC2, EMR, S3, Glacier, SQS, SNS)
    d. Mobile App Development - IOS/Android/HTML5/JQuery Mobile/PhoneGap
2. IT Staff Augmentation",14025
"Schooner Consulting and Management Services, Inc.","Schooner Consulting and Management Services provides consulting services including 1) Business and financial operations analysis; 2) Business strategic planning and revenue growth counseling including mergers, acquisitions and business alliances; 3) Developing corporate supplier diversity assessments, reporting and initiatives; and 4) Supplier diversity and workforce diversity consulting; Succession planning.",4108
"Score Printing Resources, LLC","Score Printing Resources - identifies print and fulfillment resources to help organizations meet and/or exceed their organizational goals as it relates to budgets, products, execution and delivery of said products.",14029
