name,ProductDescription,id
Empathy Tech LLC,"We supply roasted coffee beans using sustainable practices.  At Last Mile Cafe, we are committed to donating 10% of all of our revenue to charities chosen by our customers. We feel that this allows us to be an agent of change in our community, with our resources directed at causes that our customers care about. Charity nominations are requested periodically throughout the year from our community.  
",13626
"EMPIRE EQUIPMENT & SUPPLY COMPANY, INC.",WHOLESALE DISTRIBUTOR OF OFFICE AND INDUSTRIAL PRODUCTS,4400
"EMPIRE PRODUCTS, LLC.","AUTOMOTIVE WIRE HARNESS, WIRING DEVICE ASSEMBLY AND ROBOTIC CONTROLS
Electrical Contracting",4035
Empire Services Group,Empire Services Group provides professional services in the janitorial industry to companies in the Detroit area. ,13617
"EMPLOYEE CAPITAL STAFFING, LLC.","TEMPORARY STAFFING, EMPLOYEE LEASING, PAYROLL SERVICES AND RECRUITING",13674
"Energy Setup International, LLC",Energy Setup International is a renewable energy company with extensive engineering experience in the industrial and manufacturing business sector. ESI is focused on providing renewable energy products and services domestically and to developing internati,14187
"Engineering Technology Associates, Inc.","engineering services, staffing solutions, software product portfolio, software resellers",13535
ENJOI TRANSPORTATION LLC,Enjoi provides contracted service of transporting citizen of ambulatory needs and non ambulatory needs to various appointments within the City of Detroit and its surrounding suburbs.,13970
"Environmental Compliance Office, Inc",ECO provides environmental engineering services to all manufacturing and other facilities to achieve and maintain compliance with environmental and safety laws,3650
"Environmental Services of North America, Inc","Recycling & Rubbish Disposal, Hazardous & Non-Hazardous Waste Removal, Emergency Response, Landscape (design, construction, & maintenance), Snow Removal, Parking Lot Sweeping, Power Washing, Janitorial Services & Supplies, Interior Plantings, and Document",14199
Epitec,"A premier IT, engineering, and professional staffing organization that people want to work for and companies want to do business with. A company that is employee focused, customer driven and process oriented. Our mission is to be a valued resource to our customers, employees and partners. To build a company that will last by being a healthy and profitable organization that continues to grow. Our values are: we care, we embrace, we engage, we empower, we innovate, and we impact.",3865
"ePromptus, Inc","Staffing and consulting services, web development, mobile web development, healthcare IT service and training.",3683
"EPSILON TECHNOLOGIES, LLC.",Management Services,4034
EquiVac LLC,"EquiVac, LLC is a family owned and operated business that specializes in the complete kitchen exhaust cleaning as well as basic exhaust maintenance of food servicing locations throughout Southern Michigan and Northern Ohio. Although our intention of kitchen and exhaust cleaning is to offer basic cleaning services, we will not shut the doors to to diversification if it is along the lines of our core services. ",13645
"Eric and Anton Construction Company, LLC","Our long-term plan is to offer general contracting services to International customers expanding their presence in the USA.  Customers like Toyota, Nissan, Honda, FCA and their tier 1 suppliers are expanding their manufacturing, R & D, and administrative capabilities in our own backyard.  We will leverage our international expertise, contacts, and communication skills as our differentiator to win business with the international customers.  Short-term, we plan to offer various construction services to our domestic customers and sub-contracting services to international construction companies, such as, Kajima USA.",13363
"ERVINS GROUP, LLC (THE)","Sales Agency - Textile Solution provider identifying, sourcing and manufacturing custom or mass produced textile fabrics and applications.",13808
ERW TPTN Inc.,Physical Therapy Services Insurance Carve Out Management.,13588
Essence Upscale Promotions,"Promotional Items, pens,pencils, cups, bags, bumpers, umbrellas, mousepads, t-shirts, novelties specialist, awards, home spa essentials, boxes, calendars, leather goods, mugs and apparel,Corporate Apparel,Corporate Gifts,Trade Show Badge Holders,Promotional Bags & Totes,Promotional Drinkware,Trade Show Lanyards,Trade Show Neck Wallets,Promotional Pens & Writing,Name Badge Ribbons,24 Hour Promotional Items,Promotional Holiday and Seasonal Items,Bags & Totes, Apparel,Drinkware, Event Basics,Hi-Tech Items, Outdoor Items,Writing Pads,Eco-Friendly Promotional Items & Giveaways,Totes, Portfolios,Displays & Exhibits,Pencils, Markers,Ribbons,Education Promo Items,,Giveaways,Golf Promos,Healthcare Promo Items,Made In The USA,Appreciation Gifts,specializing in corporate food gift, programs Food Gifts,100% Satisfaction Guarantee,Greeting Card ,Vector art,ship on-time, handmade chocolates,candy,cookies,Fruit,Fruit Baskets, Occasion Gifts
",4126
"Essex Energy, LLC","Essex Energy, LLC provides Power Restoration after storms and natural disasters.  We are engaged in the construction of powerlines and towers.  The work performed may include new work, rehabilitation, and repairs.  
Emergency relief services due to power outages. ",10158
"Estrella Familia, LLC","Energy Consulting services to residential, commercial, and government clients by procuring natural gas rates from whole safe energy suppliers.",13817
Etaj Engineering Solutions LLC,"Provide unique engineering solutions and talent services of professionals, recruitment of engineers , technical specialist and business development in areas of Hybrids , Electrification, Autonomous Vehicles and Renewable Energy that will empower the Techs. to develop new technologies, product design and engineering support by strategic partnership with others who share the same values and visions",4589
"ETCS, Inc","Product design tooling, engineering warehousing, assembly components",4299
"Eteron, Inc.","Flocking (Fiber Coating) for the Automotive, Electronic and Apparel Industry. Light Assembly, Engineering, and Injection Molding. Purchase requistion and project management for automotive.",13852
Ethan's Global LLC,"Blue Dove pharmacy is Independent pharmacy , we provide quality personal service people deserve as well as tools  to achieve health and wellness goals by offering variety of niche services such as Health assessments, Genetic testing, same-day home delivery; medication therapy management; immunizations;",13546
Everything Technology & Project Management,"Everything Technology & Project Management (ETPM) has the capability of designing, implementing and project managing data networks, servers, firewalls, phone systems, wireless access points, security surveillance systems, card reader access, audio and video, structured cabling, Emergency Radio Response Communication systems, Cellular Booster Systems, Visitor Management system, Conference room automation, control4 and crestron.",4334
EverythingHR PEO,"EverythingHR Professional Employer Organization (PEO) solution enable employers to cost-effectively outsource the administration of payroll, human resources, employee benefits, and workers? compensation.",13445
EWP Coaching and Consulting (Explore What's Possible),"We support organizations with Professional Development, Leadership Development, and Talent Management consulting that enables you to achieve breakthrough results while building skills, knowledge, and processes that will help you:

-Reduce Turnover
-Increase Engagement
-Create a Culture of Belonging
-Enhance Your Leadership Pipeline
-Increase Your Ability to Attract Top Talent

We offer 1:1 coaching, group coaching, customizable workshops, keynotes, and partnerships with your internal teams as a strategist, advisor, and DiSC product suite vendor. ",14243
"EXCEL ELECTROCIRCUIT, INC.",PRINTED CIRCUIT BOARDS,14269
"Excellence Service Group, LLC","Bookkeeping Services, accounts payable, receivables, payroll, collections",13968
Excyl Incorporated,"In brief about Excyl, we are in IT and Engineering staffing industry since 1997. Providing quality tested resources in:
1); J2EE (DevOps, AWS, SDET, SOA) 
2); Data Technologies (Big Data, BI, DW) 
3)    Microsoft Technologies ( .Net, SQL Server, SSIS, SSRS, SSAS)
4)     Mobile Technologies (IOS, Android, Hybrid) and 
5)     GIS (Geographical Information System). 

r ",4175
"Executive Level Express, LLC",Executive Level Express specializes in Automotive Accessories or (LPO) - Limited Production Option. We currently have in our inventory Heavy Duty Universal Rubber Floor Mats for cars. There are 4 pieces per set (2 for the front and two for the rear). Each set is trim to fit and has a total net weight of 10.5 pounds. ,4379
"Exhibition Services, Inc","ESI is an Event Service Contractor that provides a variety of equipment & transportation that will enhance all aspects of your event. ESI's company foundation is based on trust, services, and professionalism. www.EsiUsa.biz",13984
"Exigent Industries, LLC","We provide facility support services; such as, grass cuts, snow removal, cleaning services, and winterizations.  We also sale products; such as, electronics, paper products, dehydrated foods, complete meal packs. We provide food services and consultant services related to customer service and training.",4565
"Exodus Consulting Group, LLC","Exodus Consulting Group, LLC is an innovative diversity, equity, and inclusion, human resources, leadership development, and strategic operations consulting group focused on partnering with small to medium-sized organizations to deliver strategic and uniquely branded solutions for growth. Founded by Cassandra Harvey, Exodus Consulting Group, LLC has built a reputation for delivering high quality services and undeniable results for individuals and organizations committed to innovative and sustainable ways of transformation.",13539
"Expedite Express Transportation Services, Inc.","We provide same day, next day and scheduled delivery of small auto parts for the auto industry, including auto supplies.",13717
"Expert Human Resources, LLC.","Expert Human Resources offers: Human Resources (HR) Audits/Assessments, workplace investigative services; HR and Labor Relations consulting; employment law compliance, leadership/management/employee training; organization restructuring and development; policy review and composition; job analysis and job descriptions; compensation/benefits review; and conflict resolution. Our services are provided to ensure organizational optimal efficiency and performance; as well as to facilitate avoidance of litigation and non-compliance penalties.",4215
Explore Tek Staffing Inc,"Explore Tek Staffing Inc is a leading provider of professional IT services and a dedicated healthcare staffing agency, offering exceptional short-term and long-term staffing solutions to healthcare organizations nationwide. With expertise in both IT and healthcare staffing, Explore Tek delivers comprehensive support to meet the diverse needs of businesses in these sectors. They specialize in rapidly recruiting niche IT skills for modernization, infrastructure, cybersecurity, cloud solutions, and more. Simultaneously, their Healthcare Division excels in swiftly onboarding candidates for short-term assignments and long-term placements at hospitals, healthcare facilities, and government levels. By seamlessly combining their IT prowess with their commitment to healthcare staffing, Explore Tek is able to provide unparalleled solutions that cater to the unique demands of organizations operating in these fields.",13383
"Exquisite Staffing Solutions, LLC.","Exquisite Staffing Solutions, LLC. (ESS) is a staffing agency with its primary focus in healthcare, assisting in meeting the demands of the healthcare industry with the nations top medical professionals. Knowing that we wanted our organization to expand outside of healthcare, we purposely didn't include the word ""Healthcare"" in our entity name.  Upon the start of our business, ESS has facilitated the placements of nurses including Registered Nurses, Licensed Practical Nurses and Certified Nursing Assistants in multiple settings throughout the state of Michigan.  Over the last year we have been working diligently to build our network of versatile clientele and professionals in other industries and outside of the state of Michigan. ",4481
Exspiravit LLC,"Exspiravit is a comprehensive professional writing agency that utilizes versatile writing competencies to strengthen communication initiatives. Our services include business writing, technical writing, financial writing, grant and proposal writing, writing for health services, social and other scientific research and writing, speech writing, public relations writing, and social media content creation.",4542
Extended Sales Enterprise,"A Detroit based boutique firm that was designed to service the customer with greater breadth and scope of product and services in the packaging industry. ESE network of supplier includes brown box, graphic packaging, litho label, pre-print and much more.",14190
Exterior Renovations LLC,"Exterior Renovations is a construction company that specializes in residential and commercial Roofing, siding, sheet metal, and gutters.",14070
"FabX Industries, Inc.","Aquest Machining has emerged as a leader in the tight tolerance cutting and machining of aluminum extrusions of various grades, sizes, and profiles. Additionally, the Company provides its customers with fabrication and fixture building, CNC prototyping, mig/tig welding, as well as vibratory deburring and assembly operations for kitting and packaging fulfillment. The Company is capable of working with a variety of materials other than aluminum, including steel, copper, brass, and plastics. Aquest?s loyal customer base appreciates the Company?s superb quality, professionalism, flexible production scheduling, short lead times, and quick turn times. While Aquest primarily does production scale work, short-run projects are also welcome, with no minimum order required for production.",14030
Facilities Maintenance Services LLC,"Commercial, Industrial and Residential Facilities maintenance, repair and restoration services.",13746
"Fall Harvest Urban Farms, LLC","Mrs. Pruitt's Gourmet CHA CHA is a family recipe dating back to the early 1830's. We are a gourmet relish specialty company. Mrs. Pruitt's Gourmet CHA CHA is a relish, condiment, sauce, marinade, spread, dip and garnish all in one. We are an alternative relish, condiment, sauce with no artificial ingredients or perservatives. The main ingredients are cabbage, green tomatoes and a special blend of herbs and spices. It contains all vegetables, gluten free and vegan friendly. It comes in Mild, Hot, Motor City Heat, Super Charge, Turbo Heat and Mrs. Pruitt's Gourmet CHA CHA Seasoning Original, Mild and Spicy flavors. The product comes in 8 oz., 16 oz., and gallon sizes. Our product is value added, sustainable and we use ingredients that you can trust. We sell at Amazon, Whole Foods, Meijers and grocery stores, health food stores, local shops and specialty stores. ",4472
Family Matters Counseling and Psychological Services Inc.,"We are Family Matters Counseling.  A team of experienced mental health professionals, ready to serve you. We specialize in the family psychology issues that matter most to you, whether that's coming to terms with the end of a marriage or simply getting the kids to listen. Our approach is practical, sensitive, convenient, and above all, confidential.  Parents and individuals come to us with all kinds of questions about different therapy methods. Through quality, experienced care, and values you can trust, we will find the answers together.",13448
Family Ties Trucking LLC,"Family Ties Trucking is a ground transportation company that specialize in the shipment freight and cargo for domestic businesses. We cover local and long-distance (interstate) deliveries using Freightliner Cascadia semi-trucks, dry vans, and refrigerated trailers.  ",8919
Farsak,"Farsak is an engineering consulting group offering solutions & services to automotive industry in:
·         Develop plant models, controls algorithm and run simulations to evaluate performance, set targets fuel economy, Co2 emission, etc.
·         Execute systems engineering best practices to determine product Specifications, and Architecture and Requirements.
·         Perform various safety & system design analyses such as HARA, FTA, STPA, FMEA, etc. (Functional Safety (ISO 26262), SOTIF (ISO 21448)) 
·         Develop plans for lifecycle phases Integration, Verification, Validation, and Testing.",10493
"Feamold, Inc.",Feamold Inc. performs Injection Molding Process simulation analysis for plastic components used in automotive and consumer products.,4266
"Filtra-Systems Company, LLC","Company specializes in providing specific engineering and manufactured filtration systems. These specialized systems filter a variety of different types of fluid.  Fluid filtration types include, but are not limited to, transmission fluids, cutting fluids, coolant fluids, heavy and light weight oils, municipal water supplies, agricultural water supplies and produced water supplies.  Some of the sophisticated systems that we design and manufacture include the ATF Packaged Hot Oil Treat System, CAFEP Crankshaft Line Coolant Filtration System, Hydromation Deep Bed Filter, and GM Mist Collectors.  We have engineered and developed over 50 patented products for the automotive, aerospace and oil & gas industry. Silt fence and other fabrics (e.g., for erosion control) merchant wholesalers.                                                                                                                                                                                                                                                                                                                                              ",4331
FIND D CORPORATION,"1.  design and develop gas assist control system, PLC control electronic switch gear panels, integrate and supply energy saving device- Invertors to industries.
2. , New product development and provide engineering services- mold simulation,
3. Design and developed and supply custom  Plastic injection molded components and assemblies injection molding Nozzles and Mold vacuum system, supply process development service for product improvements.
",14093
Finish Well Companies,Diversity management and financial education,4179
"First Class Consulting Firm, LLC","First Class Consulting Firm is a Professional Employer Organization ?PEO? that has more than 15 years of HR experience. We have a dynamic HR team that specialize  Employee Relations, Labor Laws, Collective Bargaining Agreements, Benefits, Safety, HR Compliance, Training and Development, Payroll,  and more!",4383
"First Fight, LLC",We produce creative in the commercial industry through animation and motion design for all digital & broadcast Platforms.,13392
First Nationwide Group Incorporated,"We provide Information Technology Staffing Augmentation services to Corporate and Government entities.  Theses services cross all areas of the Software Development Life Cycle encompassing Programmers/Developers, Quality Assurance Analysts, Business Analysts, Project Managers, SMEs(Subject Matter Experts), and Operations across all business application environments ",4433
"Fission Business Solutions, Inc.","We provide business consultiong services to startups, small, and troubled businesses. The company's areas of expertise are financial, accounting, sales, and operations. Fission Business Solutions will also counsel clients looking to sell their business and connecet those clients with buyers. Fission will also seek out engagements to teach business workshops throughout the region.",13957
Five Crowns Trucking LLC,Trucking,13352
"FLEX Underground and HydroExcavation, LLC","FLEX Is a minority owned, 24 hour service provider. Founded in 2019, we began operations in 2020, based in Livonia and strives to serve Southeast Michigan. Hydro excavation, daylighting, vactor services, injection pits, catch basin cleaning, pipe cleaning, sewer cleaning, storm drain cleaning",14095
Flintstone Construction LLC,"Flintstone Construction is a real estate development company servicing the metro Detroit area. Our work consists of modernizing distressed properties through the electrification of building systems with energy efficient functionality and a focus on meeting the needs of often underserved communities. The owner, Shaker Manns, is a licensed general contractor, electrical engineer and certified energy manager. ",14220
Focus Media Outdoor,Focus Media Outdoor is a national mobile billboard and Experiential marketing company.  We market and advertise our clients brands and services on our fleet of mobile billboard displays and activate at special and corporate events.,13589
"Focus Recovery, Inc. Focused Packaging Solutions & Associates","WHOLESALE DISTRIBUTOR OF PACKAGING PRODUCTS, PROCESSES, BUYS, SELLS RECYCLED PLASTICS",13807
"FONS, LLC","We provide consulting, executive coaching, and team coaching for organizations looking for help and enablement of manufacturing?s digital transformation. The process is intended to provide self-evaluation of behaviors and necessary changes to improve managerial effectiveness.",13357
"Fontenot Services, LLC","Landscaping, snow removal, ice management, wide area mowing, right of way mowing, brush hogging, grading, graffiti abatement, power washing, tree services and wood chipping services. ",4186
"For Color Girls, LLC","For Color Girls? Hair Care products.  Shampoo's, conditioners, styling products, gels, and hair sprays.  Online ecommerce store, with in-store pick up.",13505
"ForeRunner, LLC","ForeRunner provides full range of regulatory-complaint commercial and residential inspection services. Working in conjunction with a network of professional field service representatives to combine unmatched experience with the practical insight and expertise needed to complete each job in a timely and cost-effective manner. With 24-hour rush and Saturday service, we're there when you need us. General inspections: Occupancy Versification, REO Verification, Loss Draft/Casualty loss, Verification of Structural Damage. Exterior for Debris/Dumping, Construction Progress, Default Inspections: FHA, Fannie Mae, Freddie Mac, VA, Collections-Door Knocks, Foreclosure(Interior/Exterior, Weekly/Monthly) Conveyance, Evictions, Bankruptcy, Loss Mitigation, DIL, Cash for Keys. ",13864
"FORT WAYNE CONTRACTING, INC.","Roadway drainage, structure adjustments and concrete work",4208
"Fortitude Graphic Design & Printing, LLC",Offset and Digital Printing Servicing and Much More.,14252
"Fortitude Solutions, LLC","Fortitude Solutions is a full service provider of custom development and technical consulting services. We are leaders in custom application development, eCommerce, agile project management, and cloud migration services.",4583
Foundations LLC," Foundations LLC is a MRO product supplier of Safety Gloves and Personal Protective Equipment. Our primary area of focus includes industrial, medical, and the food industry. We have a small list of none PPE electronic products to offer our customers.",5152
"FRAM Group Operations, LLC","Fram Group is among North America's largest and most diversified companies servicing the vehicle and replacement parts market.  Our industry leading business includes FRAM.  We supply a broad range of automotive products under well-known industry brands, including: Autolite Spark Plugs and FRAM Filters.  Our customer base includes leading aftermarket companies as well as a diverse group of original equipment manufacturers in the automotive, trucking and various industrial vehicle markets.  We operate through global network of manufacturing facilities, distribution centers and offices located throughout the United States, Canada, Mexico and China.",4467
Fred & Son Recycle LLC,Fred & Son Recycle is a Merchant Wholesaler of Plumbing And Heating Equipment.,4566
"FREEDOM FINISHING, INC.",Manufactures Industrial Powder Coating & Electro Deposiition Coating (ecoat) of Metals,3914
Fresh Heir LLC,"Fresh Heir LLC is a sneaker accessory brand that designs and sells the following products: shoelaces, air fresheners, clothing & apparel",4580
"FROM A TO SI TRANSLATIONS, INC",Translates accurately all materials into any foreign language and provides the translations back.,14181
"Frontier Electrical, LLC.","Commercial electrical contractor specializing in power distribution, lighting & lighting controls, back-up generators & ATS, Fire Alarm, LV infrastructure & equipment, and UPS. ",13462
Full Circle Advisory Inc.,"Full Circle Advisory works with universities, hospitals and leading corporations to leverage and monetize their assets - both intellectual and physical - in today's global economy.   The firm's areas of focus include real estate strategies, technology commercialization, and international development.  ",14077
"Full View Productions, LLC","Full View Productions, LLC is a full-service digital cinema & video production company creating exceptional quality but, budget-conscious media exclusively for the corporate, government and non-profit sectors. The highly skilled Full View team of DP's, producers, camera operators, graphics designers, editors, and technical advisors work in concert with our clients to develop comprehensive, media based solutions to the toughest problems. ",4319
"Future Technologies, Inc","Leak testing automation. Assembly automation, welding automation",4205
"FutureNet Group, Inc.",Infrastructure improvement services utilizing innovative technology,13793
